,Datetime,Tweet Id,Text,Username,Retweet Count,Quote Count,Like Count,Quoted,Retweet,Mentioned Users
50,2022-09-12 21:26:30+00:00,1569437321736380417,💅🏿👨🏿👑 Tune-in to the latest episode of My Black Influence to watch Jason Carter (@jjcforever) of 'All About Drag' Facebook Group slay while discussing the impact Black Drag Queens have had from Harlem to Hollywood over the last century. #MyBlackFeels https://t.co/R27YDLRZq3,facebook,7,6,46,,,"[User(username='jjcforever', id=134753128, displayname='jason', rawDescription=None, renderedDescription=None, descriptionLinks=None, verified=None, created=None, followersCount=None, friendsCount=None, statusesCount=None, favouritesCount=None, listedCount=None, mediaCount=None, location=None, protected=None, link=None, profileImageUrl=None, profileBannerUrl=None, label=None)]"
51,2022-09-07 17:55:02+00:00,1567572164118732807,"ICYMI! 📣 Apps are LIVE for the 2022 Community Accelerator—a 4-month program providing funding, training &amp; more to selected community leaders. If you run a Facebook Group and are interested, learn more 👇 &amp; apply by 9/10 @ 11:59pm using the code SC2022.
https://t.co/ErEkFwISTY",facebook,10,5,55,,,
52,2022-09-01 17:11:39+00:00,1565386920523440132,"(2/2) “The Leading Wellness Community For Women, Trans and GNC Folx / Facebook Group / 591 members,” then “Dance accepts everyone / Facebook Group / 367k members,” and finally “Gay Camping Friends/ Facebook Group / 135.8k members”",facebook,3,2,33,,,
53,2022-09-01 17:11:39+00:00,1565386918573101056,"(1/2) Alt Text: Three iterations of a trans non-binary person, Canyon, poses for still photos in their living room. As the screen scrolls from left to right, the differently-dressed, stationary versions of Canyon change poses.",facebook,4,3,41,,,
54,2022-08-31 23:43:13+00:00,1565123071421333504,Canyon C. (they/them) is trans non-binary. And also a professional dancer. And also a nature enthusiast. Dance moves them. Nature captures them. There’s endless Facebook Groups to fit every part of them. Watch how Canyon C. loves to #FitOut. https://t.co/7ApOjaHwqn,facebook,16,6,88,,,
55,2022-08-30 19:55:27+00:00,1564703362507055109,"People are multidimensional. Canyon (they/them) is living proof. They’re a trans non-binary person. A dancer. And also a nature enthusiast. There’s a Facebook Group for every side of Canyon. There’s a Facebook Group for every part of you, too. Join in to #FitOut. https://t.co/gqSZ0wNDbu",facebook,17,5,85,,,
56,2022-08-25 16:00:01+00:00,1562832176592420864,"Unfazed…yeah, that’s the mood we’re mastering with Hocus Modus. Stay tuned and don’t miss Krissy W.’s story through our newest series, ‘The Super Ordinary,' where they channel the power of creating 🔥 fits to bring their full personality to life. #MyBlackFeels https://t.co/uoZp4qsoVK",facebook,15,7,81,,,
57,2022-08-24 20:45:30+00:00,1562541632943038464,"Created by the Ballroom community in the early 1990’s, the Latex Ball is part of @GMHC’s year-round House of Latex and Project Vogue programming that uses creative approaches to public health messaging, including outreach to the community through Facebook and @Instagram.",facebook,8,2,39,,,"[User(username='GMHC', id=92370760, displayname='GMHC', rawDescription=None, renderedDescription=None, descriptionLinks=None, verified=None, created=None, followersCount=None, friendsCount=None, statusesCount=None, favouritesCount=None, listedCount=None, mediaCount=None, location=None, protected=None, link=None, profileImageUrl=None, profileBannerUrl=None, label=None), User(username='instagram', id=180505807, displayname='Instagram', rawDescription=None, renderedDescription=None, descriptionLinks=None, verified=None, created=None, followersCount=None, friendsCount=None, statusesCount=None, favouritesCount=None, listedCount=None, mediaCount=None, location=None, protected=None, link=None, profileImageUrl=None, profileBannerUrl=None, label=None)]"
58,2022-08-24 20:45:03+00:00,1562541521450180608,"🔟’s, 🔟’s, 🔟’s across the board! Together with @Instagram, we partnered with #TheLatexBall, the largest annual event of the international House &amp; Ball community. https://t.co/qHFV9QI66Z",facebook,16,3,75,,,"[User(username='instagram', id=180505807, displayname='Instagram', rawDescription=None, renderedDescription=None, descriptionLinks=None, verified=None, created=None, followersCount=None, friendsCount=None, statusesCount=None, favouritesCount=None, listedCount=None, mediaCount=None, location=None, protected=None, link=None, profileImageUrl=None, profileBannerUrl=None, label=None)]"
59,2022-08-23 19:28:56+00:00,1562159974834372608,"Feeling comfortable in your skin can be hard for anyone. But as a Black queer person, it can be especially challenging. That’s why Krissy, our first featured hero in our ‘The Super Ordinary’ comic series, learned to create fits that are just as powerful as they are! #MyBlackFeels https://t.co/1BpEO6Exl3",facebook,12,5,72,,,
60,2022-08-22 21:13:44+00:00,1561823962748837888,"We're celebrating Asian &amp; Pacific Islanders like Sriram E., member of the ‘Subtle Curry Traits’ Facebook Group, who enjoys being part of a like-minded community that amplifies each other’s work.",facebook,1,2,25,,,
61,2022-08-22 21:13:44+00:00,1561823961368985602,"""...and now I run a platform for South Asian music and dance. I found my niche in the world, and I live comfortably in it. I, too, belong. Once my family joined me on my journey, they all agreed - I am living my most authentic life, and I'm at peace with myself.” - Sriram E.""",facebook,0,1,28,,,
62,2022-08-22 21:13:43+00:00,1561823959049445377,"“As the older son in a traditional Indian family, I felt pressured to follow a conventional career path. It wasn’t what I wanted, and I didn’t want to live my life in regret. Against all odds, I decided to pursue my creative passions...."" https://t.co/2Qkf3nVBH6",facebook,7,2,55,,,
63,2022-08-22 20:00:02+00:00,1561805414374641665,"“Don’t I look like you?”

Comedian @omgvinita talks with her mom about where she gets the inspiration for her material. https://t.co/ajnfnBJAqA",facebook,3,3,32,,,"[User(username='omgvinita', id=29476210, displayname='Vinita', rawDescription=None, renderedDescription=None, descriptionLinks=None, verified=None, created=None, followersCount=None, friendsCount=None, statusesCount=None, favouritesCount=None, listedCount=None, mediaCount=None, location=None, protected=None, link=None, profileImageUrl=None, profileBannerUrl=None, label=None)]"
64,2022-08-22 19:15:44+00:00,1561794267491729411,"Have you ever imagined quitting your job and joining the circus?

Meet someone who actually did it. 'Asian Creative Network' Facebook Group member Christine talks about leaving her cushy day job after falling in love with the aerial arts. https://t.co/rVUib6OgfR",facebook,11,6,50,,,
65,2022-08-22 00:11:00+00:00,1561506183676137475,"Watch as Rubina and her dad, Rey, talk about her career as a roller skate content creator, and how she found community through planning AAPI roller skating Facebook events. https://t.co/UMZAiUUWn9",facebook,8,2,51,,,
66,2022-08-21 21:58:04+00:00,1561472732998651904,"Video Description: @omgvinita and her mother sit down to discuss Vinita’s job as a Comedian and Actress. Even though her mother wanted her to go towards a more traditional path, they discover they’re actually quite similar, as Vinita’s mom was also a rebel in her youth.",facebook,1,1,21,,,"[User(username='omgvinita', id=29476210, displayname='Vinita', rawDescription=None, renderedDescription=None, descriptionLinks=None, verified=None, created=None, followersCount=None, friendsCount=None, statusesCount=None, favouritesCount=None, listedCount=None, mediaCount=None, location=None, protected=None, link=None, profileImageUrl=None, profileBannerUrl=None, label=None)]"
67,2022-08-21 21:54:05+00:00,1561471730249498629,"“We’re both rebellious women who go after what we want.”

Comedian &amp; content creator @omgvinita talks with her mom about where she gets the inspo for her material. Vinita is grateful for the support she found in her community, 'Subtle Curry Traits,' where she shares her sketches. https://t.co/vH5uOlVoWk",facebook,5,3,38,,,"[User(username='omgvinita', id=29476210, displayname='Vinita', rawDescription=None, renderedDescription=None, descriptionLinks=None, verified=None, created=None, followersCount=None, friendsCount=None, statusesCount=None, favouritesCount=None, listedCount=None, mediaCount=None, location=None, protected=None, link=None, profileImageUrl=None, profileBannerUrl=None, label=None)]"
68,2022-08-18 16:10:11+00:00,1560298019886665728,"Introducing ‘The Super Ordinary,” where REAL people from real Facebook Groups like ‘Black Teachers Rock’ and ‘Black Women in Tech’ showcase their super ordinary superpowers! #MyBlackFeels https://t.co/yUiPV7e5Hw",facebook,15,5,69,,,
69,2022-08-17 20:40:00+00:00,1560003532325113858,"Watch as Rubina and her dad, Rey, talk about her career as a roller skate content creator, and how she found community through planning AAPI roller skating Facebook events. https://t.co/h89CRuLPgr",facebook,10,7,50,,,
70,2022-08-17 19:39:12+00:00,1559988231692636160,"We're celebrating Asian &amp; Pacific Islanders like Stephanie C., who find support and understanding inside the 'subtle asian traits' Facebook Group.",facebook,4,1,29,,,
71,2022-08-17 19:39:11+00:00,1559988229197074433,"“Because I grew up in a diverse community, I didn’t feel the sting of racism and discrimination until later on, especially during the rise of Asian hate crimes. I felt the need to step in and help because I wanted to give a voice to the voiceless.” - Stephanie C. https://t.co/Xtr4T4xkLx",facebook,17,4,93,,,
72,2022-08-16 23:04:46+00:00,1559677576557330433,"(2/2) stars of a comic called The Super Ordinary. The cover says real people with real superpowers, and that the fight against Black exceptionalism has begun.",facebook,0,1,17,,,
73,2022-08-16 23:04:46+00:00,1559677575366164482,"(1/2) Video description: The video begins with swelling music and the message: Within the Ordinary is the Extraordinary. Then we see photos of four people, Krissy Williams, Niya McCray, Sammy Rigaud and Jacinth Headlam transform into comic book animations of themselves...",facebook,2,0,17,,,
74,2022-08-16 23:03:20+00:00,1559677215205466112,"With the idea of “Black Excellence” comes the pressure to be 100% perfect all the time. But nobody can live up to that superhuman standard.

Introducing ‘The Super Ordinary.’ Real people with the everyday superpowers of being themselves. Coming soon! 🦸🏿‍♂️💪🏾 #MyBlackFeels https://t.co/VtZX7BXc68",facebook,6,2,41,,,
75,2022-08-09 21:09:12+00:00,1557111780878565377,"Video Description: Stacy Ike, a film-enthusiast and member of the ‘Reel Black Filmmakers’ Facebook Group is in front of a variety of horror-film adjacent images detailing how the 1960s film ‘Night of the Living Dead’ has impacted the horror genre.",facebook,6,1,35,,,
76,2022-08-09 21:08:52+00:00,1557111696455507976,"Grab some 🍿 and tune-in to watch Stacy Ike (@onetakestace), a film-enthusiast, entertainment reporter and 'Reel Black Filmmakers' Facebook Group member, discover the impact Black actors &amp; filmmakers have had on the horror-genre in the first episode of My Black Influence. https://t.co/So40yQDHjr",facebook,14,4,71,,,"[User(username='onetakestace', id=302272670, displayname='Stacy Ike', rawDescription=None, renderedDescription=None, descriptionLinks=None, verified=None, created=None, followersCount=None, friendsCount=None, statusesCount=None, favouritesCount=None, listedCount=None, mediaCount=None, location=None, protected=None, link=None, profileImageUrl=None, profileBannerUrl=None, label=None)]"
77,2022-08-05 18:27:09+00:00,1555621444633202688,"Others were smaller, but equally as important actions, like showing up with kindness and inspiring others to do the same. Here, we share these inspiring stories, and ask our community: What’s your Act of Pride, today, tomorrow and beyond? #ActsofPride #ShareWithPride",facebook,9,3,32,,,
78,2022-08-05 18:27:08+00:00,1555621443295232000,"For #Pride2022, we talked to activists all around the country about their #ActsofPride. Some are larger pursuits, like founding organizations or raising donations for their community.",facebook,9,2,30,,,
79,2022-08-05 18:26:49+00:00,1555621362324148231,"#Pride is a celebration, but it’s so much more than just a party. Pride is about action: Acting for yourself and your community with intention, thoughtfulness, and love. https://t.co/KNyNWx1LZS",facebook,24,6,79,,,
80,2022-08-05 16:00:00+00:00,1555584416419700736,"What do 🍦, 🚀 and 🛼 have in common? They’re each culture-defining contributions from the Black community. Stay tuned for My Black Influence, a new Facebook series that celebrates the Black inventors, inventions, people and movements that help shape our world. #MyBlackFeels https://t.co/EpxC21v9fU",facebook,17,3,58,,,
81,2022-08-03 18:07:16+00:00,1554891664979890179,"""We want to be a place where everyone feels welcome to speak on what they need, and hopefully find someone out there who can help.” #ActsofPride #ShareWithPride",facebook,6,4,33,,,
82,2022-08-03 18:07:15+00:00,1554891663625052161,"“My #ActofPride is ensuring that everyone feels like they have a place to go and be seen and appreciated, especially when they’re up against a barrier.""",facebook,5,1,27,,,
83,2022-08-03 18:07:15+00:00,1554891662329057292,Community members and organizers came together to discuss resource-building and safety protocols for events. Rocky says the resulting Group has helped his community to create in new and expansive ways.,facebook,7,2,30,,,
84,2022-08-03 18:06:45+00:00,1554891538487992320,"Rocky L. (he/him) is a co-creator and admin of 'TRANSATX', a Facebook Group built in response to safety concerns for the trans community in Austin and Central Texas. After a 2017 town hall centering trans and gender diverse people. https://t.co/38ToDoH5oz",facebook,8,3,37,,,
85,2022-08-03 16:00:02+00:00,1554859646451687425,"The range of the Black identity can’t be discussed in one episode, but @CoachClayTV &amp; @ItsVad3 are always down for a challenge. 🏀 🎮 Watch the full stream from ‘Chapter 3: Shades of Black’ here: https://t.co/TV2613osBJ, and stay tuned for more from @FacebookGaming. #MyBlackFeels https://t.co/9t5SUMoSBu",facebook,9,2,35,,,"[User(username='CoachClayTV', id=156825226, displayname='CoachClayTV', rawDescription=None, renderedDescription=None, descriptionLinks=None, verified=None, created=None, followersCount=None, friendsCount=None, statusesCount=None, favouritesCount=None, listedCount=None, mediaCount=None, location=None, protected=None, link=None, profileImageUrl=None, profileBannerUrl=None, label=None), User(username='ItsVad3', id=1353604394395316224, displayname='NVADE', rawDescription=None, renderedDescription=None, descriptionLinks=None, verified=None, created=None, followersCount=None, friendsCount=None, statusesCount=None, favouritesCount=None, listedCount=None, mediaCount=None, location=None, protected=None, link=None, profileImageUrl=None, profileBannerUrl=None, label=None), User(username='FacebookGaming', id=918574108148764672, displayname='Facebook Gaming', rawDescription=None, renderedDescription=None, descriptionLinks=None, verified=None, created=None, followersCount=None, friendsCount=None, statusesCount=None, favouritesCount=None, listedCount=None, mediaCount=None, location=None, protected=None, link=None, profileImageUrl=None, profileBannerUrl=None, label=None)]"
86,2022-08-03 08:40:22+00:00,1554749001051713536,@needs_batteries Hello! Please visit our Help Center for other options to access your account.,facebook,0,0,1,,,"[User(username='needs_batteries', id=32533729, displayname='Lee E', rawDescription=None, renderedDescription=None, descriptionLinks=None, verified=None, created=None, followersCount=None, friendsCount=None, statusesCount=None, favouritesCount=None, listedCount=None, mediaCount=None, location=None, protected=None, link=None, profileImageUrl=None, profileBannerUrl=None, label=None)]"
87,2022-08-01 22:01:35+00:00,1554225859195801600,.@brionajenkins shows up for herself while baking to help navigate intersectionality in the queer space. #ActsofPride #ShareWithPride,facebook,1,1,15,,,"[User(username='brionajenkins', id=217851768, displayname='Bri Jenkins (she/her)', rawDescription=None, renderedDescription=None, descriptionLinks=None, verified=None, created=None, followersCount=None, friendsCount=None, statusesCount=None, favouritesCount=None, listedCount=None, mediaCount=None, location=None, protected=None, link=None, profileImageUrl=None, profileBannerUrl=None, label=None)]"
88,2022-08-01 22:01:35+00:00,1554225857677479943,"A radical tool for compassion, @brionajenkins encourages others to bake and build a community through methods of self-care. She says that the group has helped her incorporate rest as her act of resilience.",facebook,1,3,14,,,"[User(username='brionajenkins', id=217851768, displayname='Bri Jenkins (she/her)', rawDescription=None, renderedDescription=None, descriptionLinks=None, verified=None, created=None, followersCount=None, friendsCount=None, statusesCount=None, favouritesCount=None, listedCount=None, mediaCount=None, location=None, protected=None, link=None, profileImageUrl=None, profileBannerUrl=None, label=None)]"
89,2022-08-01 22:01:34+00:00,1554225856133857280,".@brionajenkins (she/her) is a member of the ‘Austin Queer Connection’ Facebook Group, which is a space that fosters community for Austin-based, Black and POC LGBTQIA+ organizers, helping them connect and support one another.",facebook,1,0,1,,,"[User(username='brionajenkins', id=217851768, displayname='Bri Jenkins (she/her)', rawDescription=None, renderedDescription=None, descriptionLinks=None, verified=None, created=None, followersCount=None, friendsCount=None, statusesCount=None, favouritesCount=None, listedCount=None, mediaCount=None, location=None, protected=None, link=None, profileImageUrl=None, profileBannerUrl=None, label=None)]"
90,2022-08-01 22:00:53+00:00,1554225682401710080,"“My #ActofPride is being the Black, queer female representation that I needed when I was younger, because I know if we can see it, we can be it.” - @brionajenkins https://t.co/9Uat3f9vfq",facebook,7,3,34,,,"[User(username='brionajenkins', id=217851768, displayname='Bri Jenkins (she/her)', rawDescription=None, renderedDescription=None, descriptionLinks=None, verified=None, created=None, followersCount=None, friendsCount=None, statusesCount=None, favouritesCount=None, listedCount=None, mediaCount=None, location=None, protected=None, link=None, profileImageUrl=None, profileBannerUrl=None, label=None)]"
91,2022-07-30 19:55:06+00:00,1553469254489481217,"""It brings me pride and joy to ensure that not only others can come along beside me, but have the access to go further than I ever had the opportunity to.” #ActsofPride #ShareWithPride",facebook,4,0,17,,,
92,2022-07-30 19:55:06+00:00,1553469253243772928,"""My Act of Pride is being able to stand in the gap, so that no queer, trans, or gender non-conforming or non-binary person ever has to stumble or fall again.""",facebook,3,2,19,,,
93,2022-07-30 19:55:06+00:00,1553469251859714048,"“As a Southern woman of trans experience, I’ve never had a space that allows me to show up unapologetically. It’s a safe space where we come together to fight for equality, equity, and freedom for all.""",facebook,1,0,3,,,
94,2022-07-30 19:54:31+00:00,1553469104027324416,"Octavia L. (she/her) is a member of the ‘NYC Queer Activists’ Facebook Group. Octavia says the Group has helped shape her as an activist, particularly as she prepared to move from New York City back to her hometown in Georgia. https://t.co/ngovuGv7Ty",facebook,9,2,43,,,
95,2022-07-29 18:28:29+00:00,1553085066515021829,"""You are beautiful, you are valuable, and you are already enough. You are already perfect. You add so much creativity and joy to this world, so keep being you.” #ActsofPride #ShareWithPride",facebook,2,1,19,,,
96,2022-07-29 18:28:29+00:00,1553085065290203138,"“For many of us, coming out doesn’t just happen once, it happens hundreds of times, maybe thousands over our lifetime. My Act of Pride is encouraging queer people to take up more space.""",facebook,2,1,15,,,
97,2022-07-29 18:28:28+00:00,1553085063855734786,"For Sarah, being a part of the group has given them an outlet to explore their gender identity, navigate nuanced conversations with friends, family, and colleagues, and also help support them in their coming out journey.",facebook,1,0,3,,,
98,2022-07-29 18:27:59+00:00,1553084939159146496,"Sarah S. (they/she) is a member of the 'TRANSATX' Facebook Group, founded by their partner, Rocky Lane. https://t.co/NXaW48Q5RJ",facebook,4,4,38,,,
99,2022-07-29 00:32:34+00:00,1552814303396388865,"“Acting for my community means to make sure that people feel seen and heard. I like to curate and create events for people who aren't always on the forefront of scenes. We’re making sure that they are the leads, making sure that they are the headliners.” #ActsOfPride",facebook,4,0,16,,,
100,2022-07-29 00:32:13+00:00,1552814213759991810,. @airajuliet’s work focuses on making sure other Black and queer performers connect and support each other in the pursuit of creating more space for their community on stage and in the spotlight.,facebook,5,0,18,,,"[User(username='airajuliet', id=4674170054, displayname='aj', rawDescription=None, renderedDescription=None, descriptionLinks=None, verified=None, created=None, followersCount=None, friendsCount=None, statusesCount=None, favouritesCount=None, listedCount=None, mediaCount=None, location=None, protected=None, link=None, profileImageUrl=None, profileBannerUrl=None, label=None)]"
101,2022-07-29 00:31:41+00:00,1552814079500337152,". @airajuliet (she/her) is a standup comedian in Austin. She’s a member of several Facebook Groups, where she connected with other queer comedians and performers in the area. https://t.co/NBr7E0KWI9",facebook,6,1,39,,,"[User(username='airajuliet', id=4674170054, displayname='aj', rawDescription=None, renderedDescription=None, descriptionLinks=None, verified=None, created=None, followersCount=None, friendsCount=None, statusesCount=None, favouritesCount=None, listedCount=None, mediaCount=None, location=None, protected=None, link=None, profileImageUrl=None, profileBannerUrl=None, label=None)]"
102,2022-07-28 16:49:46+00:00,1552697835149295617,"""That means sharing pronouns, making sure dress codes are appropriate so people can bring their full selves, and safe places to go to the bathroom. It’s about making a more socially just society.” #ActsofPride #ShareWithPride",facebook,2,0,17,,,
103,2022-07-28 16:49:45+00:00,1552697833861644289,"""I live my life in a way that can be a mirror for others — I have open and honest conversations about my identities, what they look like, and how to be supportive.""",facebook,5,0,15,,,
104,2022-07-28 16:49:45+00:00,1552697832687239168,"“In those conversations, I’m really inviting people in to think about their own identities and how that impacts their lives.""",facebook,0,0,2,,,
105,2022-07-28 16:49:03+00:00,1552697657059151874,"Shane W. (ze/hir/hirs) is a social justice educator in Austin. Shane’s work focuses on intersectional identities, and creating space for people to show up as hir authentic selves. https://t.co/tfg8l4VPqm",facebook,8,1,33,,,
106,2022-07-27 22:06:58+00:00,1552415274418245637,".@DivaonFb &amp; @AntBellJr_ got real about representation and allyship in gaming, and it’s a can’t-miss! Catch the full episode here: https://t.co/ftVnsjeMt4. #MyBlackFeels #FitOut https://t.co/m87WIf5Qqi",facebook,8,0,39,,,"[User(username='AntBellJr_', id=506749395, displayname='🅰️🅱️', rawDescription=None, renderedDescription=None, descriptionLinks=None, verified=None, created=None, followersCount=None, friendsCount=None, statusesCount=None, favouritesCount=None, listedCount=None, mediaCount=None, location=None, protected=None, link=None, profileImageUrl=None, profileBannerUrl=None, label=None)]"
107,2022-07-25 20:06:32+00:00,1551660188796600327,"""It’s also trying to instill radical empathy with our community members, neighbors, families and allies.” #ActsofPride #ShareWithPride",facebook,0,0,17,,,
108,2022-07-25 20:06:31+00:00,1551660187483865088,"""Being the communications and outreach manager for this organization in the current political climate means I have to explain the most inaccessible portions of interacting with our state and local government.""",facebook,1,0,20,,,
109,2022-07-25 20:06:31+00:00,1551660186066190339,"“We advocate for gender expansive equity across the state of Texas. We do that by advocating at the capital. We do that through educating folks and destigmatizing what it means to have a trans and gender expansive identity.""",facebook,1,1,2,,,
110,2022-07-25 20:05:38+00:00,1551659964980232193,"Gin P. (they/them) is the communications and outreach manager at the @TransTexas, and the co-founder of the ‘Austin Queer Asians’ Facebook Group. “The Transgender Education Network of Texas is a policy-led, trans-led organization, one of four across the nation,” Gin says. https://t.co/QuXnMUwMMm",facebook,1,1,35,,,"[User(username='TransTexas', id=64076531, displayname='TENT', rawDescription=None, renderedDescription=None, descriptionLinks=None, verified=None, created=None, followersCount=None, friendsCount=None, statusesCount=None, favouritesCount=None, listedCount=None, mediaCount=None, location=None, protected=None, link=None, profileImageUrl=None, profileBannerUrl=None, label=None)]"
