,Datetime,Tweet Id,Text,Username,Retweet Count,Quote Count,Like Count,Quoted,Retweet,Mentioned Users
111,2022-07-21 22:49:23+00:00,1550251620851654656,“BTLA has been able to find a way to take the tools and resources we can gather from every little corner and pocket of the city and take our community’s dreams to the next level.” #ActsOfPride #ShareWithPride,facebook,2,1,18,,,
112,2022-07-21 22:49:23+00:00,1550251619585036289,"“We deserve care, we deserve respect, and we deserve support. When others can’t give it to us, we demand it for ourselves.”",facebook,5,4,32,,,
113,2022-07-21 22:49:22+00:00,1550251618138050562,"“I listen as much as I can to meet those needs, and I wish allies or those outside of the trans community could show up in a way that sees us in our full humanity.”",facebook,1,0,2,,,
114,2022-07-21 22:49:22+00:00,1550251616619618304,"“There were some needs we felt were being unaddressed, especially in the middle of the pandemic. We felt really left to survive on our own. There weren’t a lot of resources for people to sustain themselves, whether it’s their health, access to funds, etc.”",facebook,1,0,3,,,
115,2022-07-21 16:38:04+00:00,1550158174530969603,@Meta @KekePalmer we would road trip with @KekePalmer anywhere 🔥,facebook,1,2,26,,,"[User(username='Meta', id=2425151, displayname='Meta', rawDescription=None, renderedDescription=None, descriptionLinks=None, verified=None, created=None, followersCount=None, friendsCount=None, statusesCount=None, favouritesCount=None, listedCount=None, mediaCount=None, location=None, protected=None, link=None, profileImageUrl=None, profileBannerUrl=None, label=None), User(username='KekePalmer', id=29860364, displayname='Keke Palmer', rawDescription=None, renderedDescription=None, descriptionLinks=None, verified=None, created=None, followersCount=None, friendsCount=None, statusesCount=None, favouritesCount=None, listedCount=None, mediaCount=None, location=None, protected=None, link=None, profileImageUrl=None, profileBannerUrl=None, label=None), User(username='KekePalmer', id=29860364, displayname='Keke Palmer', rawDescription=None, renderedDescription=None, descriptionLinks=None, verified=None, created=None, followersCount=None, friendsCount=None, statusesCount=None, favouritesCount=None, listedCount=None, mediaCount=None, location=None, protected=None, link=None, profileImageUrl=None, profileBannerUrl=None, label=None)]"
116,2022-07-21 16:28:25+00:00,1550155746536574977,"The project brings Black trans community members and allies together in the pursuit of wellness and nourishment. “Being tapped into our community is a big part of leadership,” Tabitha says. #ActsOfPride #ShareWithPride",facebook,1,0,15,,,
117,2022-07-21 16:28:24+00:00,1550155745106300929,"They led the charge of building the garden in their backyard, applying for grant funding and relying on volunteer community support to build it from an empty lot to a flourishing community garden space.",facebook,2,0,13,,,
118,2022-07-21 16:28:24+00:00,1550155743797673986,"Tabitha H. is a co-founder of Black Trans Leadership Austin, and the brains behind the BTLA Community Garden.",facebook,0,0,1,,,
119,2022-07-21 16:27:27+00:00,1550155503195619332,"“We create our resources, we create our funding. We want to be able to thrive and flourish and water ourselves and water our garden and see it all come together. Black trans and queer people should be celebrated, you know? It’s tasty.” - Tabitha H. (they/them) https://t.co/li4oSgCuap",facebook,6,1,33,,,
120,2022-07-21 14:00:18+00:00,1550118472360665088,We’re making it easier for you to control what content you see and discover with our new Home and Feeds tabs on Facebook. Learn more here: https://t.co/tq3kXldy9o.,facebook,9,5,51,,,
121,2022-07-19 17:21:23+00:00,1549444300886675456,"(2/2) “The Disabled LGBTQ Group has helped me on my journey by showing me that I’m not alone,” Dayna says. “My Act of Pride is bedazzling my prosthetic arm, because people stare, and I might as well keep them staring.” #ActsofPride #ShareWithPride https://t.co/dn5piN2Rve",facebook,7,1,31,,,
122,2022-07-19 17:20:40+00:00,1549444119487029259,"(1/2) @DaynaTroisi is a member of the ‘Disabled LGBTQ’ Facebook Group, a digital gathering place for LGBTQ+ people with disabilities to discuss the issues that affect their intersecting identities. https://t.co/oKPsMkWwIA",facebook,8,2,48,,,"[User(username='DaynaTroisi', id=723541939858116608, displayname='dayna troisi', rawDescription=None, renderedDescription=None, descriptionLinks=None, verified=None, created=None, followersCount=None, friendsCount=None, statusesCount=None, favouritesCount=None, listedCount=None, mediaCount=None, location=None, protected=None, link=None, profileImageUrl=None, profileBannerUrl=None, label=None)]"
123,2022-07-15 23:26:08+00:00,1548086541322293248,"(3/3) These actions for anyone are meant to inspire our community to act in their own, wherever and whenever there’s a need. #ActsofPride #ShareWithPride https://t.co/5W8bHH916j",facebook,6,0,25,,,
124,2022-07-15 23:26:06+00:00,1548086534150115329,"(2/3) Members of the ‘TRANSATX’ Facebook Group, which supports the Black trans community in Austin, Texas compiled a list of small, but incredibly powerful ways anyone can make a difference in their communities. https://t.co/zXVelfAjG7",facebook,7,1,26,,,
125,2022-07-15 23:26:04+00:00,1548086527002980352,"(1/3) You might think you need an endless supply of time, resources, money or community support to create change. In truth, anyone can act on behalf of the LGBTQ+ community, as long as you’re willing to start. https://t.co/NWSQmpObou",facebook,12,3,49,,,
126,2022-07-15 16:00:01+00:00,1547974272672444425,"For @shordie_shordie, he’s motivated by his family to be the best and leave behind a legacy of great music. ‘Music is Happiness!’ Facebook Group and fans around the world can enjoy his new project, More Than Music Pt. 2, available on July 22nd! #MyBlackFeels https://t.co/R6HIvaG60l",facebook,6,1,41,,,"[User(username='Shordie_Shordie', id=1067075877228425216, displayname='Shordie Shordie', rawDescription=None, renderedDescription=None, descriptionLinks=None, verified=None, created=None, followersCount=None, friendsCount=None, statusesCount=None, favouritesCount=None, listedCount=None, mediaCount=None, location=None, protected=None, link=None, profileImageUrl=None, profileBannerUrl=None, label=None)]"
127,2022-07-14 20:29:41+00:00,1547679749702426625,Sign up so you don't miss 'Unguarded Chapter 3: Shades of Black' ➡️ https://t.co/e23T5pntfv,facebook,4,0,18,,,
128,2022-07-14 19:00:01+00:00,1547657182547628038,"“We’re both rebellious women who go after what we want.”

Comedian &amp; content creator @omgvinita talks with her mom about where she gets the inspiration for her material, which she shares in her community, the 'Subtle Curry Traits' Facebook Group. https://t.co/GVu7uTeIT9",facebook,3,0,24,,,"[User(username='omgvinita', id=29476210, displayname='Vinita', rawDescription=None, renderedDescription=None, descriptionLinks=None, verified=None, created=None, followersCount=None, friendsCount=None, statusesCount=None, favouritesCount=None, listedCount=None, mediaCount=None, location=None, protected=None, link=None, profileImageUrl=None, profileBannerUrl=None, label=None)]"
129,2022-07-13 21:20:11+00:00,1547330069575749634,"In other words, anyone can do the work, regardless of where you’re starting from. #ActsofPride #ShareWithPride https://t.co/8TAZd50P8i",facebook,4,0,19,,,
130,2022-07-13 21:20:09+00:00,1547330063535947782,"For @ceyenne3, founder of @GlitsInc, acting for your community doesn’t mean waiting until you have a perfect set of conditions and resources. For her, it’s a matter of starting small and thinking about how your kindness, however simple, could change someone’s day. https://t.co/z9grOjUQto",facebook,6,0,15,,,"[User(username='ceyenne3', id=1529421349, displayname='ceyenne doroshow', rawDescription=None, renderedDescription=None, descriptionLinks=None, verified=None, created=None, followersCount=None, friendsCount=None, statusesCount=None, favouritesCount=None, listedCount=None, mediaCount=None, location=None, protected=None, link=None, profileImageUrl=None, profileBannerUrl=None, label=None), User(username='GlitsInc', id=884939030261006336, displayname='GLITS Inc.', rawDescription=None, renderedDescription=None, descriptionLinks=None, verified=None, created=None, followersCount=None, friendsCount=None, statusesCount=None, favouritesCount=None, listedCount=None, mediaCount=None, location=None, protected=None, link=None, profileImageUrl=None, profileBannerUrl=None, label=None)]"
131,2022-07-13 21:18:40+00:00,1547329686891544580,"“It’s reaching out. It’s thinking about somebody less fortunate than you. Think about how your help could change their day, because believe it or not, every act of kindness changes a life.” - @ceyenne3 https://t.co/lRXSuYTx63",facebook,10,1,30,,,"[User(username='ceyenne3', id=1529421349, displayname='ceyenne doroshow', rawDescription=None, renderedDescription=None, descriptionLinks=None, verified=None, created=None, followersCount=None, friendsCount=None, statusesCount=None, favouritesCount=None, listedCount=None, mediaCount=None, location=None, protected=None, link=None, profileImageUrl=None, profileBannerUrl=None, label=None)]"
132,2022-07-13 18:37:31+00:00,1547289134263402497,"(2/2) The final scene depicts the group gathering for dinner, made from the vegetables they harvested earlier in the day.",facebook,2,0,13,,,
133,2022-07-13 18:37:31+00:00,1547289132464050178,"(1/2) Video Description: A group of Black trans people are pictured in a garden, harvesting vegetables and watering a backyard garden while laughing, and talking. Text boxes appear that read Black Trans Leadership Austin.",facebook,0,0,11,,,
134,2022-07-12 22:00:44+00:00,1546977887013724162,"In the earliest months of the COVID-19 pandemic, Tabitha (they/them) &amp; Lais (she/her) founded Black Trans Leadership Austin to provide care, leadership and support for the QTBIPOC community across central Texas, as well as offering a safe space for their community. #ActsOfPride https://t.co/3OWiaBkBeO",facebook,9,1,33,,,
135,2022-07-08 20:20:16+00:00,1545503054757339137,"‘Ballroom #clips #dips #Tea’ is a Facebook Group that connects the ballroom scene community world-wide. JourDon, Linda Y., JJ, and Sevn all connected in the Group and found their Chosen family in the NYC-based Haus of Basquiat. #ActsOfPride https://t.co/ayab4EVIFx",facebook,9,4,32,,,
136,2022-07-08 17:00:02+00:00,1545452663864696836,"“We’re both rebellious women who go after what we want.”

Comedian &amp; content creator Vinita talks with her mom about where she gets the inspiration for her material. Vinita is grateful for the support she found in the 'Subtle Curry Traits,' Facebook Group. https://t.co/EbPb4wxRFH",facebook,6,1,32,,,
137,2022-07-08 16:18:43+00:00,1545442265958686720,"“I don’t pay attention to the noise, I focus on the music. Nothing outside of the music process.” – @shordie_shordie, rap artist

‘Music is Happiness!’ Facebook Group is looking for Shordie Shordie’s next win with the July 8 release of his new single, Body Language. #MyBlackFeels https://t.co/w9DhoodG7H",facebook,5,1,32,,,"[User(username='Shordie_Shordie', id=1067075877228425216, displayname='Shordie Shordie', rawDescription=None, renderedDescription=None, descriptionLinks=None, verified=None, created=None, followersCount=None, friendsCount=None, statusesCount=None, favouritesCount=None, listedCount=None, mediaCount=None, location=None, protected=None, link=None, profileImageUrl=None, profileBannerUrl=None, label=None)]"
138,2022-07-07 21:35:50+00:00,1545159683253706753,"Watch as Rubina and her dad, Rey, talk about her career as a roller skate content creator, and how she found community through planning AAPI roller skating events through the 'Subtle Asian Traits' Facebook Group. https://t.co/XQTLiZiRMx",facebook,3,0,27,,,
139,2022-07-07 18:30:00+00:00,1545112916482961409,"‘Ballroom #clips #dips #Tea’ Facebook Group connects the ballroom scene community world-wide. JourDon, Linda Y., JJ and Sevn all connected in the Group and joined the NYC-based Haus of Basquiat, finding Chosen Family in the process. #ActsOfPride https://t.co/NYrgAig2Cu",facebook,9,1,41,,,
140,2022-07-06 20:34:55+00:00,1544781964426756097,"Charlie is a member of the ‘Queer Mental Health’ Facebook Group, and found his Chosen Family there — including Camille and Sylvester. The Group meets regularly to discuss the state of their mental health and have fun together in a supportive environment. #ActsOfPride https://t.co/JlAs2AIX6J",facebook,9,0,39,,,
141,2022-07-06 19:36:12+00:00,1544767187822559234,"According to members Charlie, Camille and Sylvester, the ‘Queer Mental Health’ Facebook Group, is a place where members can share their authentic selves, including their struggles and triumphs with mental health. It’s where this group found their Chosen Family. #ActsOfPride https://t.co/SBC9uhYVig",facebook,6,2,27,,,
142,2022-07-06 18:05:59+00:00,1544744485095186432,"“I think Facebook Groups is just an excellent platform to find people similar to you.” Hanson found his Chosen Family in the 'SQuAT (Subtle Queer Asian Traits)' Facebook Group, along with Joey, Eric and Johnny, and they regularly meet to share meals and catch up. #ActsOfPride https://t.co/cwGvg6Flsx",facebook,3,0,29,,,
143,2022-07-06 16:00:02+00:00,1544712786525032448,"It’s Pride all year long! Watch @DivaonFB and @Antbelljr_ talk all things inclusivity and allyship on the next Unguarded. Tune in LIVE on Wednesday, July 13th from 2-4 PM EST on @FacebookGaming. #MyBlackFeels #FitOut https://t.co/IQcJHFJktL",facebook,5,4,30,,,"[User(username='AntBellJr_', id=506749395, displayname='🅰️🅱️', rawDescription=None, renderedDescription=None, descriptionLinks=None, verified=None, created=None, followersCount=None, friendsCount=None, statusesCount=None, favouritesCount=None, listedCount=None, mediaCount=None, location=None, protected=None, link=None, profileImageUrl=None, profileBannerUrl=None, label=None), User(username='FacebookGaming', id=918574108148764672, displayname='Facebook Gaming', rawDescription=None, renderedDescription=None, descriptionLinks=None, verified=None, created=None, followersCount=None, friendsCount=None, statusesCount=None, favouritesCount=None, listedCount=None, mediaCount=None, location=None, protected=None, link=None, profileImageUrl=None, profileBannerUrl=None, label=None)]"
144,2022-07-06 00:31:00+00:00,1544478987379884033,"Eric is a part of the ‘SQuAT (Subtle Queer Asian Traits)’ Facebook Group, which is a place where LGBTQ+ Asian people &amp; their allies can connect. Eric’s Chosen Family includes Johnny, Hanson &amp; Joey, and they get together regularly to share a meal &amp; support each other. #ActsOfPride https://t.co/OC20nGm9fs",facebook,3,0,33,,,
145,2022-07-05 23:43:07+00:00,1544466937564069889,".@houseoflabeija isn’t just a Chosen Family; it’s a movement. Founded by Crystal LaBeija as a safe platform for people to celebrate their authentic selves, today they’re part of a Chosen Family that fosters creativity, support and love. #ActsOfPride #ShareWithPride https://t.co/NeMbkpf6xd",facebook,7,3,30,,,"[User(username='houseoflabeija', id=1261334687794036736, displayname='The House of LaBeija', rawDescription=None, renderedDescription=None, descriptionLinks=None, verified=None, created=None, followersCount=None, friendsCount=None, statusesCount=None, favouritesCount=None, listedCount=None, mediaCount=None, location=None, protected=None, link=None, profileImageUrl=None, profileBannerUrl=None, label=None)]"
146,2022-07-05 22:38:13+00:00,1544450603518246912,".@Atura_Spark &amp; @iPodKingCarter brought the 🔥heat🔥 in the Unguarded series premiere. If you missed it, catch the full episode here: https://t.co/LxqbuWYEMl and don’t miss the next episode streaming live at 2 pm EST on July 13th only on @FacebookGaming. #MyBlackFeels https://t.co/fhAqBOn4Ro",facebook,2,1,16,,,"[User(username='Atura_Spark', id=1378454408, displayname='Atura Spark', rawDescription=None, renderedDescription=None, descriptionLinks=None, verified=None, created=None, followersCount=None, friendsCount=None, statusesCount=None, favouritesCount=None, listedCount=None, mediaCount=None, location=None, protected=None, link=None, profileImageUrl=None, profileBannerUrl=None, label=None), User(username='ipodkingcarter', id=34788302, displayname='iPodKingCarter', rawDescription=None, renderedDescription=None, descriptionLinks=None, verified=None, created=None, followersCount=None, friendsCount=None, statusesCount=None, favouritesCount=None, listedCount=None, mediaCount=None, location=None, protected=None, link=None, profileImageUrl=None, profileBannerUrl=None, label=None), User(username='FacebookGaming', id=918574108148764672, displayname='Facebook Gaming', rawDescription=None, renderedDescription=None, descriptionLinks=None, verified=None, created=None, followersCount=None, friendsCount=None, statusesCount=None, favouritesCount=None, listedCount=None, mediaCount=None, location=None, protected=None, link=None, profileImageUrl=None, profileBannerUrl=None, label=None)]"
147,2022-07-05 18:01:00+00:00,1544380840796426247,"“We get to share our experience. We get to share our love and support. Facebook Groups help us stay connected as a family, communicate as a family, express ourselves as a family, and elevate as a family.” -- @houseoflabeija on the power of their Chosen Family. #ActsOfPride https://t.co/kftb21Lz7A",facebook,7,3,38,,,"[User(username='houseoflabeija', id=1261334687794036736, displayname='The House of LaBeija', rawDescription=None, renderedDescription=None, descriptionLinks=None, verified=None, created=None, followersCount=None, friendsCount=None, statusesCount=None, favouritesCount=None, listedCount=None, mediaCount=None, location=None, protected=None, link=None, profileImageUrl=None, profileBannerUrl=None, label=None)]"
148,2022-06-24 01:23:18+00:00,1540143496778203136,"“We are no different from heteronormative family. The love that we have for each other, it surpasses all.” Octavia, a member of the ‘NYC Queer Activists’ Facebook Group, describes the love of her Chosen Family with Group members Josiah and Brianna. #ActsOfPride #ShareWithPride https://t.co/kOfeoBeKMc",facebook,16,4,72,,,
149,2022-06-23 22:34:05+00:00,1540100909472129024,"The ‘NYC Queer Activists' Facebook Group is a digital meeting ground for diverse individuals who are activists and advocates in their communities. It’s also the place where Brianna, Octavia, and Josiah found their Chosen Family. #ActsOfPride #ShareWithPride https://t.co/kI1Oprc14c",facebook,9,2,44,,,
150,2022-06-17 17:20:51+00:00,1537847757939032064,"2/2 Text boxes appear reading, “Awesome Assistants of Color / Facebook Group / 1.5K members,” then “LGBT Outdoors / Facebook Group / 4.3k members,” and finally “LGBTQ Movie Club / Facebook Group / 22k members”",facebook,2,0,23,,,
151,2022-06-17 17:20:51+00:00,1537847756634705920,"1/2 Alt Text: A non-binary person is showcasing different parts of who they are: relaxing in the comfort of their home, practicing archery at a range, writing movie scripts at their desk. Throughout, their aura exudes happiness, confidence, and determination.",facebook,3,3,29,,,
152,2022-06-17 17:20:15+00:00,1537847606096891907,"Whitney W. (they/them) is non-binary, an archer and also a filmmaker. There’s a Facebook Group for every Whitney W. that stars in the movie of their life: ‘Awesome Assistants of Color’, ‘LGBT Outdoors’ and ‘LGBTQ Movie Club’ Facebook Groups. Watch now. Lights, camera, #FitOut. https://t.co/UTy25d7iEd",facebook,11,5,64,,,
153,2022-06-17 15:21:50+00:00,1537817805285994496,"Black Feelings have entered the game!🎮 See @IpodKingCarter and @Atura_Spark more exposed than ever before in Unguarded. 

Streaming LIVE at https://t.co/lFNpGs1zGv on Wednesday, June 22nd! #MyBlackFeels https://t.co/c6KtlazS5m",facebook,5,3,34,,,"[User(username='ipodkingcarter', id=34788302, displayname='iPodKingCarter', rawDescription=None, renderedDescription=None, descriptionLinks=None, verified=None, created=None, followersCount=None, friendsCount=None, statusesCount=None, favouritesCount=None, listedCount=None, mediaCount=None, location=None, protected=None, link=None, profileImageUrl=None, profileBannerUrl=None, label=None), User(username='Atura_Spark', id=1378454408, displayname='Atura Spark', rawDescription=None, renderedDescription=None, descriptionLinks=None, verified=None, created=None, followersCount=None, friendsCount=None, statusesCount=None, favouritesCount=None, listedCount=None, mediaCount=None, location=None, protected=None, link=None, profileImageUrl=None, profileBannerUrl=None, label=None)]"
154,2022-06-16 21:59:06+00:00,1537555392577908743,"Featuring: @Atura_Spark, @IpodKingCarter, @CoachClayTv, @ItsVad3, @Antbelljr_ and @DivaonFb!",facebook,1,1,20,,,"[User(username='Atura_Spark', id=1378454408, displayname='Atura Spark', rawDescription=None, renderedDescription=None, descriptionLinks=None, verified=None, created=None, followersCount=None, friendsCount=None, statusesCount=None, favouritesCount=None, listedCount=None, mediaCount=None, location=None, protected=None, link=None, profileImageUrl=None, profileBannerUrl=None, label=None), User(username='ipodkingcarter', id=34788302, displayname='iPodKingCarter', rawDescription=None, renderedDescription=None, descriptionLinks=None, verified=None, created=None, followersCount=None, friendsCount=None, statusesCount=None, favouritesCount=None, listedCount=None, mediaCount=None, location=None, protected=None, link=None, profileImageUrl=None, profileBannerUrl=None, label=None), User(username='CoachClayTV', id=156825226, displayname='CoachClayTV', rawDescription=None, renderedDescription=None, descriptionLinks=None, verified=None, created=None, followersCount=None, friendsCount=None, statusesCount=None, favouritesCount=None, listedCount=None, mediaCount=None, location=None, protected=None, link=None, profileImageUrl=None, profileBannerUrl=None, label=None), User(username='ItsVad3', id=1353604394395316224, displayname='NVADE', rawDescription=None, renderedDescription=None, descriptionLinks=None, verified=None, created=None, followersCount=None, friendsCount=None, statusesCount=None, favouritesCount=None, listedCount=None, mediaCount=None, location=None, protected=None, link=None, profileImageUrl=None, profileBannerUrl=None, label=None), User(username='AntBellJr_', id=506749395, displayname='🅰️🅱️', rawDescription=None, renderedDescription=None, descriptionLinks=None, verified=None, created=None, followersCount=None, friendsCount=None, statusesCount=None, favouritesCount=None, listedCount=None, mediaCount=None, location=None, protected=None, link=None, profileImageUrl=None, profileBannerUrl=None, label=None)]"
155,2022-06-16 21:59:05+00:00,1537555388358336512,.@FacebookGaming presents Unguarded. Watch LIVE as your favorite gamers 🎮 drop their armor in-game — and irl. Black feelings have entered the game. Stream the first episode LIVE at https://t.co/6OgVJccpsd on June 22! #MyBlackFeels https://t.co/KJOllri0Fb,facebook,7,10,53,,,"[User(username='FacebookGaming', id=918574108148764672, displayname='Facebook Gaming', rawDescription=None, renderedDescription=None, descriptionLinks=None, verified=None, created=None, followersCount=None, friendsCount=None, statusesCount=None, favouritesCount=None, listedCount=None, mediaCount=None, location=None, protected=None, link=None, profileImageUrl=None, profileBannerUrl=None, label=None)]"
156,2022-06-13 20:26:44+00:00,1536444982244024321,Award Winning Performing Artist John-Andrew Morrison surprised members of the ‘All Things Broadway’ Facebook Group with a behind-the-scenes tour backstage at the Lyceum Theater. #ShareWithPride,facebook,3,0,20,,,
157,2022-06-13 20:26:43+00:00,1536444978687352832,"In celebration of #Pride Month, we partnered with Tony Award-Winner &amp; Pulitzer Prize-winning musical, @StrangeLoopBway, to launch a new #ShowYourSkills AR Effect. https://t.co/gMWp6m0r2y",facebook,12,3,66,,,
158,2022-06-07 22:18:05+00:00,1534298680366333952,His chosen family—a group of other trans men with similar interests— kept him motivated on his journey to lose 200 lbs. over two years. Everyone in the family genuinely encourages each other: brother to brother. ❤️ 🧡 💛 💚 💙 💜,facebook,5,1,23,,,
159,2022-06-07 22:18:05+00:00,1534298678969737216,"With the support of the group’s creator, Alex L. (he/him) in the black tank top and members like Alex R. (he/him) in the zip-up hoodie and Jack (he/him) in the blue muscle tee, Marty was inspired to live a healthy lifestyle.",facebook,5,1,22,,,
160,2022-06-07 22:18:05+00:00,1534298677530984448,He found the family and support he needed in We are transman bodybuilders on Facebook Groups.,facebook,3,0,10,,,
161,2022-06-07 22:18:04+00:00,1534298675878445056,There's the family you're born into and then there's the family you choose along the way. Marty is a trans man who grew up in a family that strictly adhered to the gender binary. He never felt as though his parents would accept his true identity.,facebook,3,0,12,,,
162,2022-06-07 22:18:04+00:00,1534298672296599553,"“I’m a trans man. My mother told me she’ll never see me as her son. It’s painful to hear that from her but I found other guys who see me as their brother. They’ll always have a brother in me for that.”-Marty (he/him), the proud man in the green shirt. https://t.co/pM5urEXLxD",facebook,18,8,89,,,
